[
  {
    "id": "shopping.amazon",
    "name": "Amazon tracking",
    "description": "Affiliate tags, referral and session params across Amazon marketplaces. ccTLDs enumerated (no PSL).",
    "matcher": {
      "type": "host",
      "suffix": [
        "amazon.com", "amazon.co.uk", "amazon.de", "amazon.fr", "amazon.it",
        "amazon.es", "amazon.nl", "amazon.se", "amazon.pl", "amazon.com.tr",
        "amazon.ca", "amazon.com.mx", "amazon.com.br", "amazon.co.jp",
        "amazon.in", "amazon.com.au", "amazon.sg", "amazon.ae", "amazon.sa"
      ]
    },
    "actions": [
      {
        "type": "removeParameters",
        "select": {
          "names": ["tag", "ref", "ref_", "psc", "qid", "sr", "keywords", "sprefix",
                    "crid", "dib", "dib_tag", "th", "pf", "linkCode", "linkId", "camp",
                    "creative", "creativeASIN", "ascsubtag", "smid", "spLa", "sp_csd"]
        }
      },
      { "type": "removeParameters", "select": { "prefix": "pf_rd_" } },
      { "type": "removeParameters", "select": { "prefix": "pd_rd_" } }
    ],
    "source": "builtIn",
    "category": "shopping"
  }
]
